Frame 1: 78 bytes on wire (624 bits), 78 bytes captured (624 bits)
Ethernet II, Src: 00:01:c0:04:3b:c4, Dst: 00:17:f2:cc:73:a7
Internet Protocol Version 4, Src: 172.16.0.1, Dst: 172.16.0.10
Transmission Control Protocol, Src Port: 32821, Dst Port: 13600, Seq: 1, Ack: 1, Len: 12
Example_2 Protocol, Type: cs_start (7077899)  Size: 8  
    Header
        Type: cs_start (7077899)
        Size: 8
    id: 0
    acronym: 
    Trailer
        trailer[0]: 0
        trailer[1]: 0
        trailer[2]: 0

Frame 2: 1050 bytes on wire (8400 bits), 1050 bytes captured (8400 bits)
Ethernet II, Src: 00:17:f2:cc:73:a7, Dst: 00:01:c0:04:3b:c4
Internet Protocol Version 4, Src: 172.16.0.10, Dst: 172.16.0.1
Transmission Control Protocol, Src Port: 13600, Dst Port: 32821, Seq: 1, Ack: 13, Len: 984
Example_2 Protocol, Type: sc_start_ack (65547)  Size: 980  
    Header
        Type: sc_start_ack (65547)
        Size: 980
    id: 0
    end_of_msg: 00f400807468020000a000ffff1f00000000001800ffff01…
    Trailer
        trailer[0]: 222
        trailer[1]: 2
        trailer[2]: 0

Frame 3: 106 bytes on wire (848 bits), 106 bytes captured (848 bits)
Ethernet II, Src: 00:01:c0:04:3b:c4, Dst: 00:17:f2:cc:73:a7
Internet Protocol Version 4, Src: 172.16.0.1, Dst: 172.16.0.10
Transmission Control Protocol, Src Port: 32821, Dst Port: 13600, Seq: 13, Ack: 985, Len: 40
Example_2 Protocol, Type: cs_request (3604485)  Size: 36  
    Header
        Type: cs_request (3604485)
        Size: 36
    id: 0
    end_of_msg[0]: 0
    end_of_msg[1]: 160
    end_of_msg[2]: 0
    end_of_msg[3]: 87
    end_of_msg[4]: 0
    end_of_msg[5]: 0
    end_of_msg[6]: 0
    end_of_msg[7]: 8
    end_of_msg[8]: 0
    end_of_msg[9]: 0
    end_of_msg[10]: 0
    end_of_msg[11]: 255
    end_of_msg[12]: 255
    end_of_msg[13]: 255
    end_of_msg[14]: 0
    end_of_msg[15]: 98
    end_of_msg[16]: 0
    end_of_msg[17]: 5
    end_of_msg[18]: 0
    end_of_msg[19]: 12
    end_of_msg[20]: 0
    end_of_msg[21]: 0
    end_of_msg[22]: 0
    end_of_msg[23]: 66
    end_of_msg[24]: 73
    end_of_msg[25]: 71
    end_of_msg[26]: 45
    end_of_msg[27]: 82
    end_of_msg[28]: 69
    end_of_msg[29]: 81
    end_of_msg[30]: 85
    end_of_msg[31]: 69
    Trailer
        trailer[0]: 83
        trailer[1]: 84
        trailer[2]: 83

Frame 4: 98 bytes on wire (784 bits), 98 bytes captured (784 bits)
Ethernet II, Src: 00:17:f2:cc:73:a7, Dst: 00:01:c0:04:3b:c4
Internet Protocol Version 4, Src: 172.16.0.10, Dst: 172.16.0.1
Transmission Control Protocol, Src Port: 13600, Dst Port: 32821, Seq: 985, Ack: 53, Len: 32
Example_2 Protocol, Type: sc_ctx_data (65538)  Size: 28  
    Header
        Type: sc_ctx_data (65538)
        Size: 28
    id: 0
    end_of_msg[0][0][0]: 0
    end_of_msg[1][0][0]: 0
    end_of_msg[0][1][0]: 0
    end_of_msg[1][1][0]: 1
    end_of_msg[0][2][0]: 135
    end_of_msg[1][2][0]: 0
    end_of_msg[0][0][1]: 0
    end_of_msg[1][0][1]: 0
    end_of_msg[0][1][1]: 0
    end_of_msg[1][1][1]: 0
    end_of_msg[0][2][1]: 0
    end_of_msg[1][2][1]: 0
    end_of_msg[0][0][2]: 0
    end_of_msg[1][0][2]: 0
    end_of_msg[0][1][2]: 0
    end_of_msg[1][1][2]: 0
    end_of_msg[0][2][2]: 0
    end_of_msg[1][2][2]: 0
    end_of_msg[0][0][3]: 0
    end_of_msg[1][0][3]: 40
    end_of_msg[0][1][3]: 0
    end_of_msg[1][1][3]: 0
    end_of_msg[0][2][3]: 0
    end_of_msg[1][2][3]: 91
    Trailer
        trailer[0]: 192
        trailer[1]: 1
        trailer[2]: 0

